{
  "image_id": "ARMS/001",
  "run_id": "selective-run",
  "segmentation_method": "classical_baseline",
  "inpainting_method": {
    "run_id": "default",
    "algorithm": "telea",
    "inpaint_algorithm": "INPAINT_TELEA",
    "inpaint_radius": 3.0,
    "dilation": {
      "enabled": false
    }
  },
  "target_language": "vi",
  "ocr_engine": {
    "name": "manga-ocr",
    "version": null,
    "deterministic": true
  },
  "translation_provider": {
    "name": "fixture",
    "model": "fixture",
    "version": "1",
    "deterministic": false,
    "secret_env_var": null
  },
  "rendering_config": {
    "font_path": "D:\\Work\\DIP\\manga-text-segmentation-translation\\assets\\fonts\\DejaVuSans.ttf",
    "font_size": 32,
    "min_font_size": 12,
    "text_direction": "horizontal",
    "expansion_allowance": 0,
    "color": [
      0,
      0,
      0,
      255
    ],
    "stroke_width": 0,
    "background": null,
    "wrap": true,
    "line_spacing": 1.0,
    "align_h": "center",
    "align_v": "middle"
  },
  "regions": [
    {
      "region_id": 1,
      "bbox": [
        100,
        100,
        120,
        60
      ],
      "polygon": [
        [
          100,
          100
        ],
        [
          219,
          100
        ],
        [
          219,
          159
        ],
        [
          100,
          159
        ]
      ],
      "orientation": "horizontal",
      "reading_order_index": 1,
      "merged_from": 1,
      "crop_path": "crops/1.png",
      "clipped": false,
      "ocr_text": "source-3",
      "ocr_confidence": null,
      "ocr_status": "ok",
      "ocr_error": null,
      "manually_edited": false,
      "translation": "source-3",
      "translation_status": "failed",
      "translation_error": "controlled page-stage failure",
      "cache_status": "miss",
      "failure_policy": "keep_ocr_text",
      "render_status": "rendered",
      "render_warning": null,
      "font_size_used": 27,
      "line_count": 1,
      "display_box": [
        100,
        100,
        120,
        60
      ],
      "direction_used": "horizontal",
      "ocr_time_seconds": 4.699992132373154e-06,
      "translation_time_seconds": 2.400000812485814e-05,
      "render_time_seconds": null
    }
  ],
  "stage_timings": {
    "intake": 0.13795590000518132,
    "regions": 0.058047200000146404,
    "ocr": 0.0302092000056291,
    "translate": 0.003254199997172691,
    "render": 0.08760179999808315
  },
  "status": "ok"
}
